{
	"$schema": "./schemas/seed.schema.json",
	"version": "1",
	"meta": {
		"name": "PremiumCMS site seed",
		"description": "The PremiumCMS product site: landing, pricing, about, legal, sign-up / sign-in and the customer dashboard (powered by the Platform plugin frontend), plus the blog. Applied on every deploy (update-on-conflict)."
	},
	"collections": [],
	"menus": [
		{
			"name": "primary",
			"label": "Primary",
			"items": [
				{
					"type": "custom",
					"label": "Home",
					"url": "/"
				},
				{
					"type": "custom",
					"label": "Pricing",
					"url": "/pricing"
				},
				{
					"type": "custom",
					"label": "Blog",
					"url": "/posts"
				},
				{
					"type": "custom",
					"label": "About",
					"url": "/about"
				},
				{
					"type": "custom",
					"label": "Sign in",
					"url": "/signin"
				}
			]
		},
		{
			"name": "social",
			"label": "Social",
			"items": []
		},
		{
			"name": "legal",
			"label": "Legal",
			"items": [
				{
					"type": "custom",
					"label": "Terms",
					"url": "/terms"
				},
				{
					"type": "custom",
					"label": "Privacy",
					"url": "/privacy"
				},
				{
					"type": "custom",
					"label": "About",
					"url": "/about"
				}
			]
		}
	],
	"redirects": [
		{
			"source": "/admin",
			"destination": "/_emdash/admin",
			"type": 302
		}
	],
	"widgetAreas": [
		{
			"name": "footer",
			"label": "Footer widgets",
			"description": "Rendered in the footer's widget column.",
			"widgets": [
				{
					"type": "content",
					"title": "About",
					"content": [
						{
							"_type": "block",
							"style": "normal",
							"_key": "w0",
							"markDefs": [],
							"children": [
								{
									"_type": "span",
									"_key": "w1",
									"text": "Edit this widget under Manage → Widgets, or replace it in seed/seed.json."
								}
							]
						}
					]
				},
				{
					"type": "menu",
					"title": "Legal",
					"menuName": "legal"
				}
			]
		}
	],
	"content": {}
}
